{
  "schema_version": 1,
  "taste_event_id": "44444444-4444-4444-8444-444444444444",
  "subject_id": "11111111-1111-4111-8111-111111111111",
  "operation": "assert",
  "occurred_at": "2026-08-23T09:20:00Z",
  "recorded_at": "2026-08-23T09:20:05Z",
  "target": {
    "entity_type": "track",
    "entity_id": "22222222-2222-4222-8222-222222222222",
    "entity_revision": 1,
    "label": "Synthetic Night Signal"
  },
  "signal_type": "rating",
  "polarity": "positive",
  "strength": 0.8,
  "explicitness": "explicit",
  "basis_refs": [
    {
      "record_type": "listening_event",
      "record_id": "33333333-3333-4333-8333-333333333333"
    }
  ],
  "rating": {
    "value": 4,
    "scale_min": 0,
    "scale_max": 5
  },
  "note": "The gradual texture change worked well for focused listening.",
  "provenance": {
    "source_kind": "user_input",
    "captured_at": "2026-08-23T09:20:05Z"
  }
}
